{"componentChunkName":"component---src-templates-blog-js","path":"/showcase","result":{"data":{"mdx":{"frontmatter":{"title":"Showcase","date":"2019"},"body":"function _extends() { _extends = Object.assign || function (target) { for (var i = 1; i < arguments.length; i++) { var source = arguments[i]; for (var key in source) { if (Object.prototype.hasOwnProperty.call(source, key)) { target[key] = source[key]; } } } return target; }; return _extends.apply(this, arguments); }\n\nfunction _objectWithoutProperties(source, excluded) { if (source == null) return {}; var target = _objectWithoutPropertiesLoose(source, excluded); var key, i; if (Object.getOwnPropertySymbols) { var sourceSymbolKeys = Object.getOwnPropertySymbols(source); for (i = 0; i < sourceSymbolKeys.length; i++) { key = sourceSymbolKeys[i]; if (excluded.indexOf(key) >= 0) continue; if (!Object.prototype.propertyIsEnumerable.call(source, key)) continue; target[key] = source[key]; } } return target; }\n\nfunction _objectWithoutPropertiesLoose(source, excluded) { if (source == null) return {}; var target = {}; var sourceKeys = Object.keys(source); var key, i; for (i = 0; i < sourceKeys.length; i++) { key = sourceKeys[i]; if (excluded.indexOf(key) >= 0) continue; target[key] = source[key]; } return target; }\n\n/* @jsx mdx */\nvar _frontmatter = {\n  \"title\": \"Showcase\",\n  \"date\": \"2019\"\n};\n\nvar makeShortcode = function makeShortcode(name) {\n  return function MDXDefaultShortcode(props) {\n    console.warn(\"Component \" + name + \" was not imported, exported, or provided by MDXProvider as global scope\");\n    return mdx(\"div\", props);\n  };\n};\n\nvar Youtube = makeShortcode(\"Youtube\");\nvar layoutProps = {\n  _frontmatter: _frontmatter\n};\nvar MDXLayout = \"wrapper\";\nreturn function MDXContent(_ref) {\n  var components = _ref.components,\n      props = _objectWithoutProperties(_ref, [\"components\"]);\n\n  return mdx(MDXLayout, _extends({}, layoutProps, props, {\n    components: components,\n    mdxType: \"MDXLayout\"\n  }), mdx(\"h2\", {\n    \"id\": \"python\",\n    \"style\": {\n      \"position\": \"relative\"\n    }\n  }, mdx(\"a\", _extends({\n    parentName: \"h2\"\n  }, {\n    \"href\": \"#python\",\n    \"aria-label\": \"python permalink\",\n    \"className\": \"icon-heading-class before\"\n  }), mdx(\"svg\", _extends({\n    parentName: \"a\"\n  }, {\n    \"aria-hidden\": \"true\",\n    \"height\": \"20\",\n    \"version\": \"1.1\",\n    \"viewBox\": \"0 0 16 16\",\n    \"width\": \"20\"\n  }), mdx(\"path\", _extends({\n    parentName: \"svg\"\n  }, {\n    \"fillRule\": \"evenodd\",\n    \"d\": \"M4 9h1v1H4c-1.5 0-3-1.69-3-3.5S2.55 3 4 3h4c1.45 0 3 1.69 3 3.5 0 1.41-.91 2.72-2 3.25V8.59c.58-.45 1-1.27 1-2.09C10 5.22 8.98 4 8 4H4c-.98 0-2 1.22-2 2.5S3 9 4 9zm9-3h-1v1h1c1 0 2 1.22 2 2.5S13.98 12 13 12H9c-.98 0-2-1.22-2-2.5 0-.83.42-1.64 1-2.09V6.25c-1.09.53-2 1.84-2 3.25C6 11.31 7.55 13 9 13h4c1.45 0 3-1.69 3-3.5S14.5 6 13 6z\"\n  })))), \"Python\"), mdx(\"p\", null, \"Started working with Python since 2013, I had \", mdx(\"inlineCode\", {\n    parentName: \"p\"\n  }, \"22\"), \" projects built using Python. Most of them were built on Odoo Framework. I also built \", mdx(\"a\", _extends({\n    parentName: \"p\"\n  }, {\n    \"href\": \"/bci/python-dev/python/truck\"\n  }), \"Automated Truck Scheduling System\"), \" using Pandas and Flask.\"), mdx(\"p\", null, \"I know that \", mdx(\"strong\", {\n    parentName: \"p\"\n  }, \"BCI Asia essentially requires Django Developer\"), \", but I am trying to convince that I am capable to work on Django if later I'm accepted. \"), mdx(\"p\", null, \"The main reasons are : \"), mdx(\"ul\", null, mdx(\"li\", {\n    parentName: \"ul\"\n  }, \"Have been working with Odoo Python Framework since 2013.\"), mdx(\"li\", {\n    parentName: \"ul\"\n  }, \"Django ORM shares lot of similarity to Odoo which can be explored \", mdx(\"a\", _extends({\n    parentName: \"li\"\n  }, {\n    \"href\": \"/bci/python-dev/django-vs-odoo\"\n  }), \"here\"), \".\"), mdx(\"li\", {\n    parentName: \"ul\"\n  }, \"Lastly, I consider myself to have \", mdx(\"strong\", {\n    parentName: \"li\"\n  }, \"strong algorithm logic\"), \", as individually built \", mdx(\"a\", _extends({\n    parentName: \"li\"\n  }, {\n    \"href\": \"/bci/python-dev/python/truck\"\n  }), \"Automated Truck Scheduling System\"), \". As a replacement of legacy SAS-analytic based system which had been built by 5 person within 4 months, I also improved the output accuracy by \", mdx(\"inlineCode\", {\n    parentName: \"li\"\n  }, \"700%\"), \".\")), mdx(\"h3\", {\n    \"id\": \"a-odoo-customization--odoo\",\n    \"style\": {\n      \"position\": \"relative\"\n    }\n  }, mdx(\"a\", _extends({\n    parentName: \"h3\"\n  }, {\n    \"href\": \"#a-odoo-customization--odoo\",\n    \"aria-label\": \"a odoo customization  odoo permalink\",\n    \"className\": \"icon-heading-class before\"\n  }), mdx(\"svg\", _extends({\n    parentName: \"a\"\n  }, {\n    \"aria-hidden\": \"true\",\n    \"height\": \"20\",\n    \"version\": \"1.1\",\n    \"viewBox\": \"0 0 16 16\",\n    \"width\": \"20\"\n  }), mdx(\"path\", _extends({\n    parentName: \"svg\"\n  }, {\n    \"fillRule\": \"evenodd\",\n    \"d\": \"M4 9h1v1H4c-1.5 0-3-1.69-3-3.5S2.55 3 4 3h4c1.45 0 3 1.69 3 3.5 0 1.41-.91 2.72-2 3.25V8.59c.58-.45 1-1.27 1-2.09C10 5.22 8.98 4 8 4H4c-.98 0-2 1.22-2 2.5S3 9 4 9zm9-3h-1v1h1c1 0 2 1.22 2 2.5S13.98 12 13 12H9c-.98 0-2-1.22-2-2.5 0-.83.42-1.64 1-2.09V6.25c-1.09.53-2 1.84-2 3.25C6 11.31 7.55 13 9 13h4c1.45 0 3-1.69 3-3.5S14.5 6 13 6z\"\n  })))), \"A. Odoo Customization ::: Odoo\"), mdx(\"p\", null, \"I managed to code these applications below, \", mdx(\"strong\", {\n    parentName: \"p\"\n  }, \"individually\"), \". These projects required Backend development on Python and also Frontend development on Javascript.\"), mdx(\"p\", null, mdx(\"strong\", {\n    parentName: \"p\"\n  }, \"1. Odoo 10 - Accounting System\")), mdx(\"p\", null, mdx(\"img\", _extends({\n    parentName: \"p\"\n  }, {\n    \"src\": \".img/odoo-school-billing.png\",\n    \"alt\": \"School Billing. Customized Business Process, Dot-Matrix Printing\"\n  }))), mdx(\"p\", null, mdx(\"strong\", {\n    parentName: \"p\"\n  }, \"2. New Filterable Pivot\")), mdx(\"p\", null, mdx(\"img\", _extends({\n    parentName: \"p\"\n  }, {\n    \"src\": \".img/pivot.png\",\n    \"alt\": \"Document Status Pivot Table\"\n  }))), mdx(\"p\", null, mdx(\"strong\", {\n    parentName: \"p\"\n  }, \"Engineering Document Control\"), \" built on Odoo 9.\"), mdx(\"ul\", null, mdx(\"li\", {\n    parentName: \"ul\"\n  }, \"Easy to Track \", mdx(\"inlineCode\", {\n    parentName: \"li\"\n  }, \"Document Status\"), \" (IFA, IFR, etc)\"), mdx(\"li\", {\n    parentName: \"ul\"\n  }, \"New Filterable \", mdx(\"inlineCode\", {\n    parentName: \"li\"\n  }, \"Pivot\"))), mdx(Youtube, {\n    videoId: \"j2waUwGy-mU\",\n    mdxType: \"Youtube\"\n  }), mdx(\"p\", null, mdx(\"img\", _extends({\n    parentName: \"p\"\n  }, {\n    \"src\": \".img/ddc-flow.png\",\n    \"alt\": \"Complex Document Control Management\"\n  }))), mdx(\"p\", null, mdx(\"strong\", {\n    parentName: \"p\"\n  }, \"3. Product Listing\")), mdx(\"p\", null, \"Backend and Frontend built on Odoo 11. Built view template from Scratch, applied Photoswipe.js and built pagination.\"), mdx(\"p\", null, mdx(\"img\", _extends({\n    parentName: \"p\"\n  }, {\n    \"src\": \".img/listing2.png\",\n    \"alt\": \"ayoberqurban.net - Livestock Listing and Sales Management\"\n  }))), mdx(\"p\", null, mdx(\"strong\", {\n    parentName: \"p\"\n  }, \"4. Map Integration\")), mdx(\"p\", null, mdx(\"img\", _extends({\n    parentName: \"p\"\n  }, {\n    \"src\": \".img/google-map.png\",\n    \"alt\": \"Google Map Integration\"\n  }))), mdx(\"p\", null, mdx(\"img\", _extends({\n    parentName: \"p\"\n  }, {\n    \"src\": \".img/leaflet.png\",\n    \"alt\": \"OpenStreet Map Integration using Leaflet.js\"\n  }))), mdx(\"p\", null, mdx(\"strong\", {\n    parentName: \"p\"\n  }, \"Testimonial\")), mdx(\"p\", null, mdx(\"img\", _extends({\n    parentName: \"p\"\n  }, {\n    \"src\": \".img/testi.png\",\n    \"alt\": \"One of user review in projects.co.id\"\n  }))), mdx(\"h3\", {\n    \"id\": \"b-rest-api--rest-api\",\n    \"style\": {\n      \"position\": \"relative\"\n    }\n  }, mdx(\"a\", _extends({\n    parentName: \"h3\"\n  }, {\n    \"href\": \"#b-rest-api--rest-api\",\n    \"aria-label\": \"b rest api  rest api permalink\",\n    \"className\": \"icon-heading-class before\"\n  }), mdx(\"svg\", _extends({\n    parentName: \"a\"\n  }, {\n    \"aria-hidden\": \"true\",\n    \"height\": \"20\",\n    \"version\": \"1.1\",\n    \"viewBox\": \"0 0 16 16\",\n    \"width\": \"20\"\n  }), mdx(\"path\", _extends({\n    parentName: \"svg\"\n  }, {\n    \"fillRule\": \"evenodd\",\n    \"d\": \"M4 9h1v1H4c-1.5 0-3-1.69-3-3.5S2.55 3 4 3h4c1.45 0 3 1.69 3 3.5 0 1.41-.91 2.72-2 3.25V8.59c.58-.45 1-1.27 1-2.09C10 5.22 8.98 4 8 4H4c-.98 0-2 1.22-2 2.5S3 9 4 9zm9-3h-1v1h1c1 0 2 1.22 2 2.5S13.98 12 13 12H9c-.98 0-2-1.22-2-2.5 0-.83.42-1.64 1-2.09V6.25c-1.09.53-2 1.84-2 3.25C6 11.31 7.55 13 9 13h4c1.45 0 3-1.69 3-3.5S14.5 6 13 6z\"\n  })))), \"B. Rest-API ::: Rest-API\"), mdx(\"p\", null, \"Built Rest-API using Flask, to structure Complex Nested Json, then later sent to browser as part of \", mdx(\"a\", _extends({\n    parentName: \"p\"\n  }, {\n    \"href\": \"/bci/python-dev/python/rest-api\"\n  }), \"Sales Dashboard app\"), \".\"), mdx(\"p\", null, mdx(\"img\", _extends({\n    parentName: \"p\"\n  }, {\n    \"src\": \".img/mor3.png\",\n    \"alt\": \"Three-Level Nested Json\"\n  }))), mdx(\"p\", null, mdx(\"img\", _extends({\n    parentName: \"p\"\n  }, {\n    \"src\": \".img/mor1.png\",\n    \"alt\": \"Map Markers Data received from Rest-API\"\n  }))), mdx(Youtube, {\n    videoId: \"I8C8kjiu360\",\n    mdxType: \"Youtube\"\n  }), mdx(\"h2\", {\n    \"id\": \"mobile-development--mobile\",\n    \"style\": {\n      \"position\": \"relative\"\n    }\n  }, mdx(\"a\", _extends({\n    parentName: \"h2\"\n  }, {\n    \"href\": \"#mobile-development--mobile\",\n    \"aria-label\": \"mobile development  mobile permalink\",\n    \"className\": \"icon-heading-class before\"\n  }), mdx(\"svg\", _extends({\n    parentName: \"a\"\n  }, {\n    \"aria-hidden\": \"true\",\n    \"height\": \"20\",\n    \"version\": \"1.1\",\n    \"viewBox\": \"0 0 16 16\",\n    \"width\": \"20\"\n  }), mdx(\"path\", _extends({\n    parentName: \"svg\"\n  }, {\n    \"fillRule\": \"evenodd\",\n    \"d\": \"M4 9h1v1H4c-1.5 0-3-1.69-3-3.5S2.55 3 4 3h4c1.45 0 3 1.69 3 3.5 0 1.41-.91 2.72-2 3.25V8.59c.58-.45 1-1.27 1-2.09C10 5.22 8.98 4 8 4H4c-.98 0-2 1.22-2 2.5S3 9 4 9zm9-3h-1v1h1c1 0 2 1.22 2 2.5S13.98 12 13 12H9c-.98 0-2-1.22-2-2.5 0-.83.42-1.64 1-2.09V6.25c-1.09.53-2 1.84-2 3.25C6 11.31 7.55 13 9 13h4c1.45 0 3-1.69 3-3.5S14.5 6 13 6z\"\n  })))), \"Mobile Development ::: Mobile\"), mdx(\"p\", null, mdx(\"strong\", {\n    parentName: \"p\"\n  }, \"1. Built Point of Sale App\")), mdx(\"ul\", null, mdx(\"li\", {\n    parentName: \"ul\"\n  }, \"Local Data Persistance\"), mdx(\"li\", {\n    parentName: \"ul\"\n  }, \"Percentage and Cash Discounts\"), mdx(\"li\", {\n    parentName: \"ul\"\n  }, \"Use \", mdx(\"strong\", {\n    parentName: \"li\"\n  }, \"Redux State Management\"))), mdx(\"p\", null, mdx(\"img\", _extends({\n    parentName: \"p\"\n  }, {\n    \"src\": \".img/mobile1.png\",\n    \"alt\": \"Intuitive POS App\"\n  }))), mdx(\"p\", null, mdx(\"strong\", {\n    parentName: \"p\"\n  }, \"2. Built Mobile ERP\")), mdx(\"p\", null, \"Built Rest-API using Odoo 11 and sent Data to Flutter Mobile.\"), mdx(\"ul\", null, mdx(\"li\", {\n    parentName: \"ul\"\n  }, \"List of Purchasing Orders\"), mdx(\"li\", {\n    parentName: \"ul\"\n  }, \"Create PO\"), mdx(\"li\", {\n    parentName: \"ul\"\n  }, \"Sync local State to Odoo Database\")), mdx(\"p\", null, mdx(\"img\", _extends({\n    parentName: \"p\"\n  }, {\n    \"src\": \".img/mobile2.png\",\n    \"alt\": \"Odoo Purchasing Module\"\n  }))), mdx(\"p\", null, \"For more details, we can explore this \", mdx(\"a\", _extends({\n    parentName: \"p\"\n  }, {\n    \"href\": \"/bci/python-dev/mobile\"\n  }), \"section\")), mdx(\"h2\", {\n    \"id\": \"training\",\n    \"style\": {\n      \"position\": \"relative\"\n    }\n  }, mdx(\"a\", _extends({\n    parentName: \"h2\"\n  }, {\n    \"href\": \"#training\",\n    \"aria-label\": \"training permalink\",\n    \"className\": \"icon-heading-class before\"\n  }), mdx(\"svg\", _extends({\n    parentName: \"a\"\n  }, {\n    \"aria-hidden\": \"true\",\n    \"height\": \"20\",\n    \"version\": \"1.1\",\n    \"viewBox\": \"0 0 16 16\",\n    \"width\": \"20\"\n  }), mdx(\"path\", _extends({\n    parentName: \"svg\"\n  }, {\n    \"fillRule\": \"evenodd\",\n    \"d\": \"M4 9h1v1H4c-1.5 0-3-1.69-3-3.5S2.55 3 4 3h4c1.45 0 3 1.69 3 3.5 0 1.41-.91 2.72-2 3.25V8.59c.58-.45 1-1.27 1-2.09C10 5.22 8.98 4 8 4H4c-.98 0-2 1.22-2 2.5S3 9 4 9zm9-3h-1v1h1c1 0 2 1.22 2 2.5S13.98 12 13 12H9c-.98 0-2-1.22-2-2.5 0-.83.42-1.64 1-2.09V6.25c-1.09.53-2 1.84-2 3.25C6 11.31 7.55 13 9 13h4c1.45 0 3-1.69 3-3.5S14.5 6 13 6z\"\n  })))), \"Training\"), mdx(\"p\", null, mdx(\"a\", _extends({\n    parentName: \"p\"\n  }, {\n    \"href\": \"/bci/python-dev/training\"\n  }), \"Main Instructor\"), \" of monthly training of \", mdx(\"strong\", {\n    parentName: \"p\"\n  }, \"Python 3 - Odoo 12\")), mdx(\"p\", null, mdx(\"img\", _extends({\n    parentName: \"p\"\n  }, {\n    \"src\": \".img/training.png\",\n    \"alt\": \"I was in the middle\"\n  }))));\n}\n;\nMDXContent.isMDXComponent = true;","tableOfContents":{"items":[{"url":"#python","title":"Python","items":[{"url":"#a-odoo-customization--odoo","title":"A. Odoo Customization ::: Odoo"},{"url":"#b-rest-api--rest-api","title":"B. Rest-API ::: Rest-API"}]},{"url":"#mobile-development--mobile","title":"Mobile Development ::: Mobile"},{"url":"#training","title":"Training"}]},"fields":{"dirname":"/home/haliib/dev/gatsby/rinkasan2/data/posts"}}},"pageContext":{"slug":"showcase","prev":null,"next":{"title":"Django vs Odoo","link":"/django-vs-odoo"}}},"staticQueryHashes":["3159585216","4261541374"]}